### ISSUE TITLE
Bug in NTP::ntpUpdate() ?

### ISSUE THREAD

**Issue by Akson32** [sstaub/NTP#14]
In the code below the string "udp->flush();" IMHO is not needed. In fact it sends empty malformed packet before the packet with real NTP query will be issued.

bool NTP::ntpUpdate() {
	udp->flush();
	if (server == nullptr) udp->beginPacket(serverIP, NTP_PORT);
	else udp->beginPacket(server, NTP_PORT);
	udp->write(ntpRequest, NTP_PACKET_SIZE);

]~> tcpdump -n -p -i eth0 udp port 123
tcpdump: verbose output suppressed, use -v[v]... for full protocol decode
listening on eth0, link-type EN10MB (Ethernet), snapshot length 262144 bytes

17:22:13.514331 IP 192.168.0.2.123 > 192.168.0.10.123:  [|ntp]
17:22:13.515070 IP 192.168.0.2.123 > 192.168.0.10.123: NTPv4, Client, length 48
17:22:13.515131 IP 192.168.0.10.123 > 192.168.0.2.123: NTPv4, Server, length 48

**Comment by sstaub** [comment]
should solvers in 1.7
